symbol,description,exchange,listedMarket,securityType
@NCF.OI.Z,NEWCASTLE COAL Future Total Open Interest,ICEEC,ICEEC,COMBINED_FUTURE
@NCF.VOL.Z,NEWCASTLE COAL Future Total Volume,ICEEC,ICEEC,COMBINED_FUTURE
CRD.OI.Z,WTI CRUDE Future Total Open Interest,ICEEC,ICEEC,COMBINED_FUTURE
CRD.VOL.Z,WTI CRUDE Future Total Volume,ICEEC,ICEEC,COMBINED_FUTURE
DBI.OI.Z,DUBAI 1ST LINE Future Total Open Interest,ICEEC,ICEEC,COMBINED_FUTURE
DBI.VOL.Z,DUBAI 1ST LINE Future Total Volume,ICEEC,ICEEC,COMBINED_FUTURE
EB.OI.Z,BRENT CRUDE Future Total Open Interest,ICEEC,ICEEC,COMBINED_FUTURE
EB.VOL.Z,BRENT CRUDE Future Total Volume,ICEEC,ICEEC,COMBINED_FUTURE
EBT.OI.Z,BRENT CRUDE TAS Future Total Open Interest,ICEEC,ICEEC,COMBINED_FUTURE
EBT.VOL.Z,BRENT CRUDE TAS Future Total Volume,ICEEC,ICEEC,COMBINED_FUTURE
EF.OI.Z,RICHARDS BAY COAL MONTHLY Future Total Open Interest,ICEEC,ICEEC,COMBINED_FUTURE
EF.VOL.Z,RICHARDS BAY COAL MONTHLY Future Total Volume,ICEEC,ICEEC,COMBINED_FUTURE
EFQ.OI.Z,RICHARDS BAY COAL QUARTERLY Future Total Open Interest,ICEEC,ICEEC,COMBINED_FUTURE
EFQ.VOL.Z,RICHARDS BAY COAL QUARTERLY Future Total Volume,ICEEC,ICEEC,COMBINED_FUTURE
EFS.OI.Z,RICHARDS BAY COAL SEASONAL Future Total Open Interest,ICEEC,ICEEC,COMBINED_FUTURE
EFS.VOL.Z,RICHARDS BAY COAL SEASONAL Future Total Volume,ICEEC,ICEEC,COMBINED_FUTURE
EFY.OI.Z,RICHARDS BAY COAL YEARLY Future Total Open Interest,ICEEC,ICEEC,COMBINED_FUTURE
EFY.VOL.Z,RICHARDS BAY COAL YEARLY Future Total Volume,ICEEC,ICEEC,COMBINED_FUTURE
ET.OI.Z,ROTTERDAM COAL MONTHLY Future Total Open Interest,ICEEC,ICEEC,COMBINED_FUTURE
ET.VOL.Z,ROTTERDAM COAL MONTHLY Future Total Volume,ICEEC,ICEEC,COMBINED_FUTURE
ETQ.OI.Z,ROTTERDAM COAL QUARTERLY Future Total Open Interest,ICEEC,ICEEC,COMBINED_FUTURE
ETQ.VOL.Z,ROTTERDAM COAL QUARTERLY Future Total Volume,ICEEC,ICEEC,COMBINED_FUTURE
ETS.OI.Z,ROTTERDAM COAL SEASONAL Future Total Open Interest,ICEEC,ICEEC,COMBINED_FUTURE
ETS.VOL.Z,ROTTERDAM COAL SEASONAL Future Total Volume,ICEEC,ICEEC,COMBINED_FUTURE
ETY.OI.Z,ROTTERDAM COAL YEARLY Future Total Open Interest,ICEEC,ICEEC,COMBINED_FUTURE
ETY.VOL.Z,ROTTERDAM COAL YEARLY Future Total Volume,ICEEC,ICEEC,COMBINED_FUTURE
FN.OI.Z,NATURAL GAS BALANCING POINT Future Total Open Interest,ICEEC,ICEEC,COMBINED_FUTURE
FN.VOL.Z,NATURAL GAS BALANCING POINT Future Total Volume,ICEEC,ICEEC,COMBINED_FUTURE
FNQ.OI.Z,NATURAL GAS - QUARTERLY BAL PT Future Total Open Interest,ICEEC,ICEEC,COMBINED_FUTURE
FNQ.VOL.Z,NATURAL GAS - QUARTERLY BAL PT Future Total Volume,ICEEC,ICEEC,COMBINED_FUTURE
FNS.OI.Z,NATURAL GAS - SEASONAL BAL PT Future Total Open Interest,ICEEC,ICEEC,COMBINED_FUTURE
FNS.VOL.Z,NATURAL GAS - SEASONAL BAL PT Future Total Volume,ICEEC,ICEEC,COMBINED_FUTURE
GAS.OI.Z,LOW SULPHUR GAS OIL NEW Future Total Open Interest,ICEEC,ICEEC,COMBINED_FUTURE
GAS.VOL.Z,LOW SULPHUR GAS OIL NEW Future Total Volume,ICEEC,ICEEC,COMBINED_FUTURE
GWT.OI.Z,NATURAL GAS BALANCING POINT TAS Future Total Open Interest,ICEEC,ICEEC,COMBINED_FUTURE
GWT.VOL.Z,NATURAL GAS BALANCING POINT TAS Future Total Volume,ICEEC,ICEEC,COMBINED_FUTURE
GWY.OI.Z,NATURAL GAS BALANCING POINT YEARLY Future Total Open Interest,ICEEC,ICEEC,COMBINED_FUTURE
GWY.VOL.Z,NATURAL GAS BALANCING POINT YEARLY Future Total Volume,ICEEC,ICEEC,COMBINED_FUTURE
HOS.OI.Z,PERMIAN WTI CRUDE OIL STORAGE Future Total Open Interest,ICEEC,ICEEC,COMBINED_FUTURE
HOS.VOL.Z,PERMIAN WTI CRUDE OIL STORAGE Future Total Volume,ICEEC,ICEEC,COMBINED_FUTURE
HOU.OI.Z,PERMIAN WTI CRUDE OIL Future Total Open Interest,ICEEC,ICEEC,COMBINED_FUTURE
HOU.VOL.Z,PERMIAN WTI CRUDE OIL Future Total Volume,ICEEC,ICEEC,COMBINED_FUTURE
IHO.OI.Z,HEATING OIL Future Total Open Interest,ICEEC,ICEEC,COMBINED_FUTURE
IHO.VOL.Z,HEATING OIL Future Total Volume,ICEEC,ICEEC,COMBINED_FUTURE
IRB.OI.Z,NYH (RBOB) GASOLINE Future Total Open Interest,ICEEC,ICEEC,COMBINED_FUTURE
IRB.VOL.Z,NYH (RBOB) GASOLINE Future Total Volume,ICEEC,ICEEC,COMBINED_FUTURE
IRBT.OI.Z,NYH (RBOB) GASOLINE TAS Future Total Open Interest,ICEEC,ICEEC,COMBINED_FUTURE
IRBT.VOL.Z,NYH (RBOB) GASOLINE TAS Future Total Volume,ICEEC,ICEEC,COMBINED_FUTURE
LHT.OI.Z,HEATING OIL-TAS Future Total Open Interest,ICEEC,ICEEC,COMBINED_FUTURE
LHT.VOL.Z,HEATING OIL-TAS Future Total Volume,ICEEC,ICEEC,COMBINED_FUTURE
NCQ.OI.Z,NEWCASTLE COAL QUARTERLY Future Total Open Interest,ICEEC,ICEEC,COMBINED_FUTURE
NCQ.VOL.Z,NEWCASTLE COAL QUARTERLY Future Total Volume,ICEEC,ICEEC,COMBINED_FUTURE
NCY.OI.Z,NEWCASTLE COAL YEARLY Future Total Open Interest,ICEEC,ICEEC,COMBINED_FUTURE
NCY.VOL.Z,NEWCASTLE COAL YEARLY Future Total Volume,ICEEC,ICEEC,COMBINED_FUTURE
O62.OI.Z,NYH ULTRA LOW SULPHUR DIESEL Future Total Open Interest,ICEEC,ICEEC,COMBINED_FUTURE
O62.VOL.Z,NYH ULTRA LOW SULPHUR DIESEL Future Total Volume,ICEEC,ICEEC,COMBINED_FUTURE
O67.OI.Z,NYH ULTRA LOW SULPHUR HEATING OIL Future Total Open Interest,ICEEC,ICEEC,COMBINED_FUTURE
O67.VOL.Z,NYH ULTRA LOW SULPHUR HEATING OIL Future Total Volume,ICEEC,ICEEC,COMBINED_FUTURE
UBL.OI.Z,UK ELECTRICITY BASELOAD GREGORIAN Future Total Open Interest,ICEEC,ICEEC,COMBINED_FUTURE
UBL.VOL.Z,UK ELECTRICITY BASELOAD GREGORIAN Future Total Volume,ICEEC,ICEEC,COMBINED_FUTURE
UBQ.OI.Z,UK ELEC BASE GREGORIAN QUARTERLY Future Total Open Interest,ICEEC,ICEEC,COMBINED_FUTURE
UBQ.VOL.Z,UK ELEC BASE GREGORIAN QUARTERLY Future Total Volume,ICEEC,ICEEC,COMBINED_FUTURE
UKA.OI.Z,UKA Future Total Open Interest,ICEEC,ICEEC,COMBINED_FUTURE
UKA.VOL.Z,UKA Future Total Volume,ICEEC,ICEEC,COMBINED_FUTURE
UKD.OI.Z,UK NBP GAS 1ST LINE FINANCIAL FUTURES Future Total Open Interest,ICEEC,ICEEC,COMBINED_FUTURE
UKD.VOL.Z,UK NBP GAS 1ST LINE FINANCIAL FUTURES Future Total Volume,ICEEC,ICEEC,COMBINED_FUTURE
UPL.OI.Z,UK ELECTRICITY PEAK GREGORIAN Future Total Open Interest,ICEEC,ICEEC,COMBINED_FUTURE
UPL.VOL.Z,UK ELECTRICITY PEAK GREGORIAN Future Total Volume,ICEEC,ICEEC,COMBINED_FUTURE
UZQ.OI.Z,UK ELECTRICITY PEAK GREGORIAN QUARTERLY Future Total Open Interest,ICEEC,ICEEC,COMBINED_FUTURE
UZQ.VOL.Z,UK ELECTRICITY PEAK GREGORIAN QUARTERLY Future Total Volume,ICEEC,ICEEC,COMBINED_FUTURE
WBT.OI.Z,WTI CRUDE TAS Future Total Open Interest,ICEEC,ICEEC,COMBINED_FUTURE
WBT.VOL.Z,WTI CRUDE TAS Future Total Volume,ICEEC,ICEEC,COMBINED_FUTURE
